Restoran Adı,Adres,Telefon
Balıkçı Asiye,"Ömerağa Mah. Şehabettin Bilgisu Cad, Latif Bey Sk. No:18, 41000 İzmit/Kocaeli",(0262) 324 40 60
Tarif Cağ Kebap,"Mehmet Ali Paşa Mahallesi, Adnan Menderes Blv. No:3, 41050 İzmit/Kocaeli",0530 773 61 06
Pizzaköy İzmit Yahyakaptan Şubesi,"Yenişehir, Demokrasi Cd. No: 80/A, 41050 İzmit/Kocaeli",0536 321 28 40
Kare Restaurant,"Yenişehir, Adnan Menderes Blv. No:8/1, 41100 İzmit/Kocaeli",(0262) 335 50 80
Antepkale Kebap,"Yenişehir, Demokrasi Cd. No:66, 41050 İzmit/Kocaeli",(0262) 313 00 33
