Restoran Adı,Adres,Telefon
AliBaba Kocaeli,"Körfez, Liman Cd. No:54, 41245 Başiskele/Kocaeli",0537 501 03 49
AliBaba Kocaeli,"Körfez, Liman Cd. No:54, 41245 Başiskele/Kocaeli",0537 501 03 49
Satuti Restaurant Cafe,"Kılıçarslan Mh, Bahçecik, Hürriyet Cd. No:127/2, 41090 Başiskele/Kocaeli",(0262) 412 41 41
Yeşildağlar Et,"D-130 KARAYOLU CADDESİ NO:183, 41030 Başiskele/Kocaeli",(0262) 343 43 46
Bilgiçler Et Köfte - Başiskele,"Körfez mah. D-130 Karayolu cad. No: 119, 41245 Başiskele/Kocaeli",(0262) 343 36 36
